{
  "contract_version": "workflow-event/1",
  "event_id": "ev_0000000000a8",
  "workflow_id": "wf_dunning-term",
  "seq": 8,
  "occurred_at": "2026-07-30T12:35:00Z",
  "producer": "knowledge-change",
  "phase": "validation",
  "outcome": "passed",
  "evidence": [
    {
      "check": "scripts/validate_concepts.py knowledge/concepts",
      "result": "pass",
      "detail": "concepts checked: 12  schema: schemas/concept.v1.json — all concepts valid"
    },
    {
      "check": "grep -c 'dunning' knowledge/concepts/index.md",
      "result": "pass",
      "detail": "1 — index row present and agreeing with the file it names"
    }
  ]
}
