{
  "contract_version": "workflow-event/1",
  "event_id": "ev_0000000000a9",
  "workflow_id": "wf_dunning-term",
  "seq": 9,
  "occurred_at": "2026-07-30T12:40:00Z",
  "producer": "knowledge-change",
  "phase": "acceptance",
  "outcome": "accepted",
  "decided_by": "maintainer:billing-domain-owner"
}
