{
  "contract_version": "workflow-event/1",
  "event_id": "ev_0000000000b7",
  "workflow_id": "wf_cancelled-order-not-billable",
  "seq": 7,
  "occurred_at": "2026-07-31T09:40:00Z",
  "producer": "knowledge-change",
  "phase": "acceptance",
  "outcome": "accepted",
  "decided_by": "maintainer:order-to-cash-owner"
}
