{
  "contract_version": "workflow-event/1",
  "event_id": "ev_0000000000b6",
  "workflow_id": "wf_cancelled-order-not-billable",
  "seq": 6,
  "occurred_at": "2026-07-31T09:26:00Z",
  "producer": "knowledge-change",
  "phase": "validation",
  "outcome": "passed",
  "evidence": [
    {
      "check": "bin/validate_knowledge.py knowledge",
      "result": "pass",
      "detail": "knowledge base knowledge: 34 file(s), 0 problem(s)"
    }
  ]
}
